希望<div class="hint">hope; wish</div>,きぼう,hope; wish,<ruby>彼<rt>かれ</rt></ruby>は <ruby>本社<rt>ほんしゃ</rt></ruby>で <ruby>働<rt>はたら</rt></ruby>くことを <ruby>希望<rt>きぼう</rt></ruby>しています。,He hopes to work at the the head office.,verbal noun
望む<div class="hint">want; hope</div>,のぞむ,want; hope,<ruby>彼<rt>かれ</rt></ruby>は <ruby>私<rt>わたし</rt></ruby>との <ruby>結婚<rt>けっこん</rt></ruby>を <ruby>望<rt>のぞ</rt></ruby>んでいます。,He wants to marry me.,verb
意志<div class="hint">will; volition</div>,いし,will; volition,<ruby>彼<rt>かれ</rt></ruby>は <ruby>意志<rt>いし</rt></ruby>の <ruby>強<rt>つよ</rt></ruby>い <ruby>人<rt>ひと</rt></ruby>です。,He is a strong-willed man.,noun
努める<div class="hint">endeavor; make efforts</div>,つとめる,endeavor; make efforts,<ruby>良<rt>い</rt></ruby>い <ruby>成績<rt>せいせき</rt></ruby>が <ruby>取<rt>と</rt></ruby>れるように <ruby>努<rt>つと</rt></ruby>めます。,I'll make efforts to get good grades.,verb
独立<div class="hint">independence; self-reliance</div>,どくりつ,independence; self-reliance,<ruby>先日<rt>せんじつ</rt></ruby> <ruby>会社<rt>かいしゃ</rt></ruby>から <ruby>独立<rt>どくりつ</rt></ruby>しました。,I left the company the other day and started my own independent business.,verbal noun
エネルギー<div class="hint">energy</div>,えねるぎー,energy,<ruby>若者<rt>わかもの</rt></ruby>たちはエネルギーにあふれていますね。,Young people are always full of energy.,noun
独特<div class="hint">unique; distinct</div>,どくとく,unique; distinct,<ruby>彼<rt>かれ</rt></ruby>の <ruby>服<rt>ふく</rt></ruby>のセンスは <ruby>独特<rt>どくとく</rt></ruby>よね。,He has a unique sense of style.,adjectival noun
独り言<div class="hint">to talk to oneself</div>,ひとりごと,to talk to oneself,<ruby>彼女<rt>かのじょ</rt></ruby>はいつも <ruby>独<rt>ひと</rt></ruby>り <ruby>言<rt>ごと</rt></ruby>を <ruby>言<rt>い</rt></ruby>うんだ。,She's always talking to herself.,noun
身長<div class="hint">stature; height</div>,しんちょう,stature; height,<ruby>身長<rt>しんちょう</rt></ruby>はどれくらいありますか。,How tall are you?,noun
自身<div class="hint">self</div>,じしん,self,<ruby>自分<rt>じぶん</rt></ruby> <ruby>自身<rt>じしん</rt></ruby>を <ruby>疑<rt>うたが</rt></ruby>ってはいけません。,Don't doubt yourself.,noun
身<div class="hint">body; oneself; one's status</div>,み,body; oneself; one's status,<ruby>旅行<rt>りょこう</rt></ruby> <ruby>中<rt>ちゅう</rt></ruby>は <ruby>身<rt>み</rt></ruby>の <ruby>安全<rt>あんぜん</rt></ruby>が <ruby>第<rt>だい</rt></ruby> <ruby>一<rt>いち</rt></ruby>です。,Personal safety is the number one priority when traveling.,noun
なさる<div class="hint">do (honorific)</div>,なさる,do (honorific),お <ruby>申<rt>もう</rt></ruby>し <ruby>込<rt>こ</rt></ruby>みなさるのでしたら、こちらにお <ruby>並<rt>なら</rt></ruby>びください。,Please line up here if you're applying.,verb
中身<div class="hint">content; interior</div>,なかみ,content; interior,かばんの <ruby>中身<rt>なかみ</rt></ruby>を <ruby>見<rt>み</rt></ruby>せてください。,Please show me the contents of your bag.,noun
全身<div class="hint">the whole body</div>,ぜんしん,the whole body,<ruby>運動<rt>うんどう</rt></ruby>した <ruby>翌日<rt>よくじつ</rt></ruby>は <ruby>全身<rt>ぜんしん</rt></ruby>の <ruby>筋肉<rt>きんにく</rt></ruby>が <ruby>痛<rt>いた</rt></ruby>い。,I have muscular pain all over my body the day after I exercise.,noun
心身<div class="hint">mind and body</div>,しんしん,mind and body,<ruby>私<rt>わたし</rt></ruby>は <ruby>心身<rt>しんしん</rt></ruby> <ruby>共<rt>とも</rt></ruby>に <ruby>疲<rt>つか</rt></ruby>れていました。,I was tired both mentally and physically.,noun
占める<div class="hint">occupy; hold</div>,しめる,occupy; hold,<ruby>私<rt>わたし</rt></ruby>に <ruby>届<rt>とど</rt></ruby>くメールのうち、 <ruby>迷惑<rt>めいわく</rt></ruby>メールが７ <ruby>割<rt>わり</rt></ruby>を <ruby>占<rt>し</rt></ruby>めている。,About 70 percent of emails sent to me are junk mail.,verb
証拠<div class="hint">proof; evidence</div>,しょうこ,proof; evidence,<ruby>証拠<rt>しょうこ</rt></ruby>を <ruby>見<rt>み</rt></ruby>つけるまで <ruby>逮捕<rt>たいほ</rt></ruby>はできません。,We can't arrest someone until we find evidence.,noun
ああ<div class="hint">like that; that much</div>,ああ,like that; that much,ああうるさい <ruby>人<rt>ひと</rt></ruby>は <ruby>苦手<rt>にがて</rt></ruby>です。,I don't like a loud person like that.,adverb
処理<div class="hint">handling; processing</div>,しょり,handling; processing,<ruby>事務<rt>じむ</rt></ruby> <ruby>的<rt>てき</rt></ruby>な <ruby>処理<rt>しょり</rt></ruby>に１ <ruby>週間<rt>しゅうかん</rt></ruby>かかります。,The administrative processing takes one week.,verbal noun
仲良く<div class="hint">harmoniously; getting along</div>,なかよく,harmoniously; getting along,あの <ruby>夫婦<rt>ふうふ</rt></ruby>は <ruby>仲良<rt>なかよ</rt></ruby>く <ruby>暮<rt>く</rt></ruby>らしているよ。,That married couple is living happily together.,adverb
仲間<div class="hint">comrade; peer</div>,なかま,comrade; peer,<ruby>彼<rt>かれ</rt></ruby>には <ruby>仲間<rt>なかま</rt></ruby>がたくさんいる。,He has a lot of peers.,noun
仲<div class="hint">relationship</div>,なか,relationship,あなたたちは <ruby>仲<rt>なか</rt></ruby>がいいですね。,You get along well together; don't you?,noun
照らす<div class="hint">illuminate; shine on</div>,てらす,illuminate; shine on,<ruby>月<rt>つき</rt></ruby>が <ruby>庭<rt>にわ</rt></ruby>を <ruby>照<rt>て</rt></ruby>らしている。,The moon is shining on the garden.,verb
クラス<div class="hint">class; category</div>,くらす,class; category,<ruby>彼<rt>かれ</rt></ruby>はビジネスクラスに <ruby>乗<rt>の</rt></ruby>ったの。,He traveled business class.,noun
工夫<div class="hint">contrivance; use of one's ingenuity</div>,くふう,contrivance; use of one's ingenuity,いろいろ <ruby>工夫<rt>くふう</rt></ruby>して <ruby>仕事<rt>しごと</rt></ruby>をやりとげたさ。,I made various adjustments and carried out the work.,verbal noun
夫人<div class="hint">wife; Mrs.</div>,ふじん,wife; Mrs.,スミス <ruby>夫人<rt>ふじん</rt></ruby>がいらっしゃいました。,Mrs. Smith is here.,noun
主婦<div class="hint">housewife</div>,しゅふ,housewife,<ruby>主婦<rt>しゅふ</rt></ruby>の <ruby>主<rt>おも</rt></ruby>な <ruby>仕事<rt>しごと</rt></ruby>は <ruby>家事<rt>かじ</rt></ruby>よ。,The main task of a housewife is housework.,noun
婦人<div class="hint">woman; lady</div>,ふじん,woman; lady,<ruby>婦人<rt>ふじん</rt></ruby> <ruby>服<rt>ふく</rt></ruby> <ruby>売<rt>う</rt></ruby>り <ruby>場<rt>ば</rt></ruby>は５ <ruby>階<rt>かい</rt></ruby>でございます。,The ladies' clothing department is on the fifth floor.,noun
夫妻<div class="hint">husband and wife; Mr. and Mrs.</div>,ふさい,husband and wife; Mr. and Mrs.,<ruby>昨日<rt>きのう</rt></ruby>の <ruby>夜<rt>よる</rt></ruby>、 <ruby>社長<rt>しゃちょう</rt></ruby>ご <ruby>夫妻<rt>ふさい</rt></ruby>と <ruby>食事<rt>しょくじ</rt></ruby>をしました。,Last night I had dinner with the president and his wife.,noun
おっしゃる<div class="hint">say; tell (honorific)</div>,おっしゃる,say; tell (honorific),あなたのおっしゃる <ruby>通<rt>とお</rt></ruby>りです。,It is as you say.,verb
奥様<div class="hint">married woman; someone's wife</div>,おくさま,married woman; someone's wife,<ruby>社長<rt>しゃちょう</rt></ruby>の <ruby>奥様<rt>おくさま</rt></ruby>はきれいな <ruby>方<rt>かた</rt></ruby>です。,The president's wife is a beautiful woman.,noun
相互<div class="hint">mutual; reciprocal</div>,そうご,mutual; reciprocal,チームの <ruby>中<rt>なか</rt></ruby>では <ruby>相互<rt>そうご</rt></ruby>の <ruby>信頼<rt>しんらい</rt></ruby>が <ruby>大切<rt>たいせつ</rt></ruby>です。,Mutual trust is important in a team.,noun
お互い<div class="hint">each other</div>,おたがい,each other,お <ruby>互<rt>たが</rt></ruby>いを <ruby>信頼<rt>しんらい</rt></ruby>することが <ruby>大事<rt>だいじ</rt></ruby>です。,It is important to trust each other.,noun
互い<div class="hint">each other</div>,たがい,each other,<ruby>互<rt>たが</rt></ruby>いの <ruby>話<rt>はなし</rt></ruby>をよく <ruby>聞<rt>き</rt></ruby>きなさい。,Listen carefully to each other.,noun
我々<div class="hint">we</div>,われわれ,we,<ruby>我々<rt>われわれ</rt></ruby>の <ruby>決意<rt>けつい</rt></ruby>は <ruby>固<rt>かた</rt></ruby>いです。,Our decision is firm.,noun
どうも<div class="hint">for some reason; somehow</div>,どうも,for some reason; somehow,<ruby>今日<rt>きょう</rt></ruby>はどうも <ruby>体<rt>からだ</rt></ruby>の <ruby>調子<rt>ちょうし</rt></ruby>が <ruby>悪<rt>わる</rt></ruby>い。,For some reason; I don't feel very well today.,adverb
年齢<div class="hint">age</div>,ねんれい,age,<ruby>彼女<rt>かのじょ</rt></ruby>の <ruby>年齢<rt>ねんれい</rt></ruby>は２７です。,She's 27 years old.,noun
可愛がる<div class="hint">love; cherish</div>,かわいがる,love; cherish,<ruby>彼女<rt>かのじょ</rt></ruby>は <ruby>猫<rt>ねこ</rt></ruby>を <ruby>可愛<rt>かわい</rt></ruby>がっています。,She cherishes her cat.,verb
愛情<div class="hint">love; affection</div>,あいじょう,love; affection,<ruby>子供<rt>こども</rt></ruby>はたくさんの <ruby>愛情<rt>あいじょう</rt></ruby>が <ruby>必要<rt>ひつよう</rt></ruby>です。,Children need a lot of love.,noun
恋愛<div class="hint">romance; relationship</div>,れんあい,romance; relationship,<ruby>彼女<rt>かのじょ</rt></ruby>は <ruby>恋愛<rt>れんあい</rt></ruby>にあこがれる <ruby>年<rt>とし</rt></ruby>ごろです。,She's at that age when girls yearn for romance.,verbal noun
シリーズ<div class="hint">series</div>,しりーず,series,このシリーズは５０ <ruby>話<rt>わ</rt></ruby>もあるそうよ。,I hear this series has as many as 50 stories.,noun
恋<div class="hint">love; romance</div>,こい,love; romance,<ruby>彼女<rt>かのじょ</rt></ruby>は <ruby>恋<rt>こい</rt></ruby>をしてきれいになったね。,She fell in love and became prettier.,noun
誕生<div class="hint">birth</div>,たんじょう,birth,<ruby>先月<rt>せんげつ</rt></ruby>、 <ruby>娘<rt>むすめ</rt></ruby>が <ruby>誕生<rt>たんじょう</rt></ruby>しました。,I gave birth to a baby girl last month.,verbal noun
延長<div class="hint">extension; prolongation</div>,えんちょう,extension; prolongation,<ruby>国会<rt>こっかい</rt></ruby>の <ruby>会期<rt>かいき</rt></ruby>が <ruby>延長<rt>えんちょう</rt></ruby>されたわね。,The Diet session has been extended.,verbal noun
延期<div class="hint">postponement; deferment</div>,えんき,postponement; deferment,<ruby>運動会<rt>うんどうかい</rt></ruby>は <ruby>雨<rt>あめ</rt></ruby>で <ruby>延期<rt>えんき</rt></ruby>されました。,The sports festival has been postponed due to the rain.,verbal noun
祝う<div class="hint">celebrate; congratulate</div>,いわう,celebrate; congratulate,<ruby>家族<rt>かぞく</rt></ruby>で <ruby>彼<rt>かれ</rt></ruby>の <ruby>合格<rt>ごうかく</rt></ruby>を <ruby>祝<rt>いわ</rt></ruby>ったよ。,His whole family celebrated his success in the exam.,verb
クラブ<div class="hint">club</div>,くらぶ,club,<ruby>夏休<rt>なつやす</rt></ruby>みにはクラブの <ruby>合宿<rt>がっしゅく</rt></ruby>に <ruby>参加<rt>さんか</rt></ruby>します。,I'll go to the club's training camp during summer vacation.,noun
単純<div class="hint">simple; uncomplicated</div>,たんじゅん,simple; uncomplicated,<ruby>彼<rt>かれ</rt></ruby>は <ruby>単純<rt>たんじゅん</rt></ruby>な <ruby>人<rt>ひと</rt></ruby>です。,He's a simple-minded person.,adjectival noun
純粋<div class="hint">pure; unmixed</div>,じゅんすい,pure; unmixed,<ruby>子供<rt>こども</rt></ruby>の <ruby>純粋<rt>じゅんすい</rt></ruby>な <ruby>心<rt>こころ</rt></ruby>を <ruby>傷付<rt>きずつ</rt></ruby>けてはいけません。,You shouldn't hurt children's pure feelings.,adjectival noun
夢中<div class="hint">be absorbed; be engrossed</div>,むちゅう,be absorbed; be engrossed,うちの <ruby>子<rt>こ</rt></ruby>はその <ruby>本<rt>ほん</rt></ruby>に <ruby>夢中<rt>むちゅう</rt></ruby>です。,Our child is engrossed in that book.,adjectival noun
慎重<div class="hint">discreet; prudent</div>,しんちょう,discreet; prudent,もう <ruby>一度<rt>いちど</rt></ruby> <ruby>慎重<rt>しんちょう</rt></ruby>に <ruby>見直<rt>みなお</rt></ruby>しましょう。,Let's prudently review it again.,adjectival noun
笑顔<div class="hint">smiling face; smile</div>,えがお,smiling face; smile,<ruby>赤<rt>あか</rt></ruby>ちゃんの <ruby>笑顔<rt>えがお</rt></ruby>が <ruby>可愛<rt>かわい</rt></ruby>い。,The baby's smile is cute.,noun
いらっしゃる<div class="hint">come; go (honorific)</div>,いらっしゃる,come; go (honorific),お <ruby>客様<rt>きゃくさま</rt></ruby>がいらっしゃいました。,Your guest has arrived.,verb
笑い<div class="hint">laughter; laugh</div>,わらい,laughter; laugh,あの <ruby>家<rt>いえ</rt></ruby>は <ruby>笑<rt>わら</rt></ruby>いが <ruby>絶<rt>た</rt></ruby>えないね。,I can always hear laughter from that house.,noun
大喜び<div class="hint">great joy</div>,おおよろこび,great joy,<ruby>弟<rt>おとうと</rt></ruby>は <ruby>新<rt>あたら</rt></ruby>しい <ruby>自転車<rt>じてんしゃ</rt></ruby>に <ruby>大<rt>おお</rt></ruby> <ruby>喜<rt>よろこ</rt></ruby>びです。,My little brother is overjoyed that he's got a new bike.,verbal noun
喜び<div class="hint">joy; delight</div>,よろこび,joy; delight,<ruby>人々<rt>ひとびと</rt></ruby>は <ruby>喜<rt>よろこ</rt></ruby>びに <ruby>沸<rt>わ</rt></ruby>いた。,People exploded with joy.,noun
弁護士<div class="hint">lawyer; attorney</div>,べんごし,lawyer; attorney,<ruby>父<rt>ちち</rt></ruby>は <ruby>弁護士<rt>べんごし</rt></ruby>です。,My father's a lawyer.,noun
看護婦<div class="hint">female nurse</div>,かんごふ,female nurse,<ruby>母<rt>はは</rt></ruby>は <ruby>看護<rt>かんご</rt></ruby> <ruby>婦<rt>ふ</rt></ruby>です。,My mother's a nurse.,noun
セット<div class="hint">set</div>,せっと,set,このメニューはサラダと <ruby>飲<rt>の</rt></ruby>み <ruby>物<rt>もの</rt></ruby>がセットになっています。,This menu comes with a salad and drink set.,verbal noun
肯定<div class="hint">affirmation</div>,こうてい,affirmation,<ruby>僕<rt>ぼく</rt></ruby>は <ruby>彼<rt>かれ</rt></ruby>のしたことは <ruby>肯定<rt>こうてい</rt></ruby>できないな。,I can't agree with what he did.,verbal noun
否定<div class="hint">denial; negation</div>,ひてい,denial; negation,<ruby>彼<rt>かれ</rt></ruby>、 <ruby>友達<rt>ともだち</rt></ruby>の <ruby>意見<rt>いけん</rt></ruby>を <ruby>否定<rt>ひてい</rt></ruby>した。,He disagreed with his friend's opinion.,verbal noun
述べる<div class="hint">state; remark</div>,のべる,state; remark,<ruby>上司<rt>じょうし</rt></ruby>が <ruby>意見<rt>いけん</rt></ruby>を <ruby>述<rt>の</rt></ruby>べた。,Our boss stated his opinion.,verb
裁判<div class="hint">trial; judgment</div>,さいばん,trial; judgment,<ruby>裁判<rt>さいばん</rt></ruby>の <ruby>様子<rt>ようす</rt></ruby>はテレビで <ruby>中継<rt>ちゅうけい</rt></ruby>されたわよ。,The trial was broadcasted live on television.,verbal noun
訴える<div class="hint">sue</div>,うったえる,sue,<ruby>彼女<rt>かのじょ</rt></ruby>は <ruby>会社<rt>かいしゃ</rt></ruby>を <ruby>訴<rt>うった</rt></ruby>えた。,She sued the company.,verb
きちんと<div class="hint">properly; neatly</div>,きちんと,properly; neatly,<ruby>問題<rt>もんだい</rt></ruby>についてきちんと <ruby>話<rt>はな</rt></ruby>し <ruby>合<rt>あ</rt></ruby>ったよ。,We discussed the problem thoroughly.,adverb
区域<div class="hint">zone; district</div>,くいき,zone; district,ここは <ruby>危険<rt>きけん</rt></ruby> <ruby>区域<rt>くいき</rt></ruby>よ。,This is a danger zone.,noun
疑問<div class="hint">question; doubt</div>,ぎもん,question; doubt,<ruby>彼<rt>かれ</rt></ruby>の <ruby>言葉<rt>ことば</rt></ruby>が <ruby>本当<rt>ほんとう</rt></ruby>かは <ruby>疑問<rt>ぎもん</rt></ruby>です。,I doubt if he was telling the truth.,noun
疑う<div class="hint">doubt; suspect</div>,うたがう,doubt; suspect,なぜあなたは <ruby>私<rt>わたし</rt></ruby>を <ruby>疑<rt>うたが</rt></ruby>うのですか。,Why do you suspect me?,verb
謎<div class="hint">puzzle; mystery</div>,なぞ,puzzle; mystery,ピラミッドには <ruby>謎<rt>なぞ</rt></ruby>が <ruby>多<rt>おお</rt></ruby>いんだ。,There are a lot of mysteries about pyramids.,noun
著者<div class="hint">author; writer</div>,ちょしゃ,author; writer,この <ruby>本<rt>ほん</rt></ruby>の <ruby>著者<rt>ちょしゃ</rt></ruby>はイギリス <ruby>人<rt>じん</rt></ruby>です。,The author of this book is British.,noun
レポート<div class="hint">report; paper</div>,れぽーと,report; paper,<ruby>教授<rt>きょうじゅ</rt></ruby>にレポートを <ruby>提出<rt>ていしゅつ</rt></ruby>しました。,I turned in my report to the professor.,verbal noun
権利<div class="hint">right; privilege</div>,けんり,right; privilege,<ruby>私<rt>わたし</rt></ruby>たちには <ruby>知<rt>し</rt></ruby>る <ruby>権利<rt>けんり</rt></ruby>があります。,We have the right to know.,noun
政権<div class="hint">political power; regime</div>,せいけん,political power; regime,<ruby>政権<rt>せいけん</rt></ruby>が <ruby>交代<rt>こうたい</rt></ruby>した。,There was a regime change.,noun
賞<div class="hint">prize; award</div>,しょう,prize; award,このデザインは <ruby>数々<rt>かずかず</rt></ruby>の <ruby>賞<rt>しょう</rt></ruby>を <ruby>受<rt>う</rt></ruby>けています。,This design has received numerous awards.,noun
財政<div class="hint">public finance; financial affairs</div>,ざいせい,public finance; financial affairs,<ruby>国<rt>くに</rt></ruby>の <ruby>財政<rt>ざいせい</rt></ruby>はとても <ruby>苦<rt>くる</rt></ruby>しい <ruby>状態<rt>じょうたい</rt></ruby>だな。,The country is in very tight financial conditions.,noun
財産<div class="hint">fortune; asset</div>,ざいさん,fortune; asset,<ruby>彼<rt>かれ</rt></ruby>は <ruby>株<rt>かぶ</rt></ruby>で <ruby>財産<rt>ざいさん</rt></ruby>の <ruby>半分<rt>はんぶん</rt></ruby>を <ruby>失<rt>うしな</rt></ruby>ったの。,He lost half his assets in the stock market.,noun
スタート<div class="hint">start; begin</div>,すたーと,start; begin,マラソンは <ruby>雨<rt>あめ</rt></ruby>の <ruby>中<rt>なか</rt></ruby>でスタートしたの。,The marathon started in the rain.,verbal noun
金融<div class="hint">finance</div>,きんゆう,finance,<ruby>彼<rt>かれ</rt></ruby>は <ruby>金融<rt>きんゆう</rt></ruby> <ruby>関係<rt>かんけい</rt></ruby>の <ruby>会社<rt>かいしゃ</rt></ruby>で <ruby>働<rt>はたら</rt></ruby>いています。,He works at a financial company.,noun
間隔<div class="hint">interval; space</div>,かんかく,interval; space,<ruby>電車<rt>でんしゃ</rt></ruby>は５ <ruby>分<rt>ふん</rt></ruby> <ruby>間隔<rt>かんかく</rt></ruby>で <ruby>来<rt>き</rt></ruby>ますよ。,The train comes every five minutes.,noun
終了<div class="hint">end; termination</div>,しゅうりょう,end; termination,コンサートは <ruby>夜<rt>よる</rt></ruby>７ <ruby>時<rt>じ</rt></ruby>５ <ruby>分<rt>ふん</rt></ruby>に <ruby>終了<rt>しゅうりょう</rt></ruby>しました。,The concert ended at 7:05 pm.,verbal noun
完了<div class="hint">completion</div>,かんりょう,completion,<ruby>仕事<rt>しごと</rt></ruby>は <ruby>全<rt>すべ</rt></ruby>て <ruby>完了<rt>かんりょう</rt></ruby>しました。,I completed all the work.,verbal noun
おる<div class="hint">be present; stay (humble)</div>,おる,be present; stay (humble),<ruby>母<rt>はは</rt></ruby>は <ruby>今<rt>いま</rt></ruby>、うちにおりません。,My mother isn't at home now.,verb
承知<div class="hint">consent; acknowledgment</div>,しょうち,consent; acknowledgment,そのことは <ruby>承知<rt>しょうち</rt></ruby>しております。,I know that.,verbal noun
承認<div class="hint">approval; recognition</div>,しょうにん,approval; recognition,これは <ruby>政府<rt>せいふ</rt></ruby>の <ruby>承認<rt>しょうにん</rt></ruby>を <ruby>受<rt>う</rt></ruby>けた <ruby>資格<rt>しかく</rt></ruby>です。,This is a qualification approved by the government.,verbal noun
納める<div class="hint">pay (tax; fee etc.)</div>,おさめる,pay (tax; fee etc.),<ruby>自動車<rt>じどうしゃ</rt></ruby> <ruby>税<rt>ぜい</rt></ruby>を <ruby>納<rt>おさ</rt></ruby>めたよ。,I paid my car tax.,verb
所得<div class="hint">income; earnings</div>,しょとく,income; earnings,ここに <ruby>去年<rt>きょねん</rt></ruby>の <ruby>所得<rt>しょとく</rt></ruby>をご <ruby>記入<rt>きにゅう</rt></ruby>ください。,Please fill in last year's income here.,noun
説得<div class="hint">persuasion</div>,せっとく,persuasion,なんとか <ruby>親<rt>おや</rt></ruby>を <ruby>説得<rt>せっとく</rt></ruby>してみるよ。,I will try my best to persuade my parents.,verbal noun
まるで<div class="hint">just like</div>,まるで,just like,<ruby>彼<rt>かれ</rt></ruby>はまるで <ruby>子供<rt>こども</rt></ruby>のようにはしゃいだよ。,He went on a spree just like a child.,adverb
得<div class="hint">advantage; gain</div>,とく,advantage; gain,この <ruby>車<rt>くるま</rt></ruby>を <ruby>今<rt>いま</rt></ruby> <ruby>買<rt>か</rt></ruby>うとお <ruby>得<rt>とく</rt></ruby>ですよ。,There's a special offer on this car if you buy it now.,adjectival noun
得する<div class="hint">profitable; beneficial</div>,とくする,profitable; beneficial,ネットで <ruby>得<rt>とく</rt></ruby>する <ruby>情報<rt>じょうほう</rt></ruby>を <ruby>見<rt>み</rt></ruby>つけたよ。,I found beneficial information on the Internet.,verb
得る<div class="hint">obtain; gain</div>,える,obtain; gain,<ruby>彼<rt>かれ</rt></ruby>は <ruby>大金<rt>たいきん</rt></ruby>を <ruby>得<rt>え</rt></ruby>ましたよ。,He gained a lot of money.,verb
納得<div class="hint">to fully understand and accept</div>,なっとく,to fully understand and accept,<ruby>彼<rt>かれ</rt></ruby>の <ruby>説明<rt>せつめい</rt></ruby>で <ruby>納得<rt>なっとく</rt></ruby>できました。,His explanation helped me fully understand it.,verbal noun
取得<div class="hint">acquisition</div>,しゅとく,acquisition,やっと <ruby>運転<rt>うんてん</rt></ruby> <ruby>免許<rt>めんきょ</rt></ruby>を <ruby>取得<rt>しゅとく</rt></ruby>しました。,I finally got my drivers' license.,verbal noun
スタイル<div class="hint">style; figure</div>,すたいる,style; figure,<ruby>彼女<rt>かのじょ</rt></ruby>はモデルのようにスタイルがいいね。,With her good figure; she looks like a model.,noun
損する<div class="hint">lose; suffer loss</div>,そんする,lose; suffer loss,わざわざ <ruby>行<rt>い</rt></ruby>って <ruby>損<rt>そん</rt></ruby>した。,I wasted my time going to all the trouble.,verb
損害<div class="hint">damage; harm</div>,そんがい,damage; harm,<ruby>町<rt>まち</rt></ruby>は <ruby>台風<rt>たいふう</rt></ruby>で <ruby>大<rt>おお</rt></ruby>きな <ruby>損害<rt>そんがい</rt></ruby>を <ruby>受<rt>う</rt></ruby>けたんだ。,The town was greatly damaged in the typhoon.,noun
損<div class="hint">loss; damage</div>,そん,loss; damage,パチンコで５０００ <ruby>円<rt>えん</rt></ruby> <ruby>損<rt>そん</rt></ruby>しました。,I lost 5;000 yen at pachinko.,verbal noun
焼き肉<div class="hint">grilled meat; barbecued meat</div>,やきにく,grilled meat; barbecued meat,<ruby>彼<rt>かれ</rt></ruby>は <ruby>焼<rt>や</rt></ruby>き <ruby>肉<rt>にく</rt></ruby>が <ruby>大好<rt>だいす</rt></ruby>きです。,He loves barbecues.,noun
乾燥<div class="hint">drying up; desiccation</div>,かんそう,drying up; desiccation,<ruby>冬<rt>ふゆ</rt></ruby>は <ruby>空気<rt>くうき</rt></ruby>が <ruby>乾燥<rt>かんそう</rt></ruby>しますね。,The air in winter is dry.,verbal noun
