コーチ<div class="hint">coach</div>,こーち,coach,<ruby>新<rt>あたら</rt></ruby>しいコーチの <ruby>指導<rt>しどう</rt></ruby>は <ruby>厳<rt>きび</rt></ruby>しかった。,The training of the new coach was hard.,verbal noun
詩人<div class="hint">poet</div>,しじん,poet,<ruby>彼<rt>かれ</rt></ruby>は <ruby>優<rt>すぐ</rt></ruby>れた <ruby>詩人<rt>しじん</rt></ruby>です。,He is a fine poet.,noun
詰まる<div class="hint">get clogged; become blocked</div>,つまる,get clogged; become blocked,このパイプは <ruby>詰<rt>つ</rt></ruby>まっていますよ。,This pipe is clogged.,verb
詰める<div class="hint">stuff (something)</div>,つめる,stuff (something),かばんに <ruby>荷物<rt>にもつ</rt></ruby>を <ruby>詰<rt>つ</rt></ruby>めました。,I packed my stuff into the bag.,verb
譲る<div class="hint">give; hand over</div>,ゆずる,give; hand over,<ruby>上司<rt>じょうし</rt></ruby>が <ruby>車<rt>くるま</rt></ruby>を <ruby>譲<rt>ゆず</rt></ruby>ってくれたの。,My boss gave me his car.,verb
盛ん<div class="hint">prosperous; thriving</div>,さかん,prosperous; thriving,その <ruby>都市<rt>とし</rt></ruby>は <ruby>商業<rt>しょうぎょう</rt></ruby>が <ruby>盛<rt>さか</rt></ruby>んよ。,Commerce is thriving in that city.,adjectival noun
ジャーナリスト<div class="hint">journalist</div>,じゃーなりすと,journalist,<ruby>彼女<rt>かのじょ</rt></ruby>は <ruby>有能<rt>ゆうのう</rt></ruby>なジャーナリストだ。,She is an able journalist.,noun
盛る<div class="hint">heap up; fill</div>,もる,heap up; fill,ご <ruby>飯<rt>はん</rt></ruby>を <ruby>盛<rt>も</rt></ruby>ってください。,Please fill the bowl with rice.,verb
兼ねる<div class="hint">serve two functions; combine</div>,かねる,serve two functions; combine,<ruby>彼女<rt>かのじょ</rt></ruby>は <ruby>秘書<rt>ひしょ</rt></ruby>と <ruby>事務<rt>じむ</rt></ruby>の <ruby>担当<rt>たんとう</rt></ruby>を <ruby>兼<rt>か</rt></ruby>ねています。,She's in charge of both secretarial and clerical work.,verb
方針<div class="hint">policy; principle</div>,ほうしん,policy; principle,<ruby>今後<rt>こんご</rt></ruby>の <ruby>方針<rt>ほうしん</rt></ruby>が <ruby>決<rt>き</rt></ruby>まった。,We've decided on our future policy.,noun
針<div class="hint">needle; (clock) hand</div>,はり,needle; (clock) hand,よく <ruby>見<rt>み</rt></ruby>たら、 <ruby>時計<rt>とけい</rt></ruby>の <ruby>針<rt>はり</rt></ruby>が１２ <ruby>時<rt>じ</rt></ruby>を <ruby>指<rt>さ</rt></ruby>してるよ。,Now that I'm looking closer; I can see the clock hands pointing at 12.,noun
鋭い<div class="hint">sharp; acute</div>,するどい,sharp; acute,<ruby>鋭<rt>するど</rt></ruby>い <ruby>刃物<rt>はもの</rt></ruby>で <ruby>指<rt>ゆび</rt></ruby>を <ruby>怪我<rt>けが</rt></ruby>した。,I injured my finger on a sharp knife.,adjective
せめて<div class="hint">at least</div>,せめて,at least,せめてこれだけは <ruby>約束<rt>やくそく</rt></ruby>してください。,At least promise this; please.,adverb
鑑賞<div class="hint">viewing; enjoyment (of art)</div>,かんしょう,viewing; enjoyment (of art),<ruby>今夜<rt>こんや</rt></ruby>はオペラ <ruby>鑑賞<rt>かんしょう</rt></ruby>に <ruby>行<rt>い</rt></ruby>きます。,I'm going to see an opera tonight.,verbal noun
寿命<div class="hint">life span</div>,じゅみょう,life span,<ruby>亀<rt>かめ</rt></ruby>の <ruby>寿命<rt>じゅみょう</rt></ruby>は <ruby>長<rt>なが</rt></ruby>いんだ。,Turtles have long life spans.,noun
谷<div class="hint">valley</div>,たに,valley,その <ruby>村<rt>むら</rt></ruby>は <ruby>深<rt>ふか</rt></ruby>い <ruby>谷<rt>たに</rt></ruby>にあるの。,The village is in a deep valley.,noun
余裕<div class="hint">room; leeway (time; money etc.)</div>,よゆう,room; leeway (time; money etc.),<ruby>出発<rt>しゅっぱつ</rt></ruby>まで <ruby>時間<rt>じかん</rt></ruby>の <ruby>余裕<rt>よゆう</rt></ruby>があります。,We have plenty of time before departure.,noun
もともと<div class="hint">originally; by nature</div>,もともと,originally; by nature,<ruby>彼女<rt>かのじょ</rt></ruby>はもともとフランスに <ruby>行<rt>い</rt></ruby>くつもりだったの。,She was originally planning to go to France.,adverb
沖<div class="hint">offshore</div>,おき,offshore,<ruby>沖<rt>おき</rt></ruby>に <ruby>小島<rt>こじま</rt></ruby>が <ruby>見<rt>み</rt></ruby>えます。,We can see a small island off the shore.,noun
湾<div class="hint">bay; gulf</div>,わん,bay; gulf,<ruby>東京<rt>とうきょう</rt></ruby> <ruby>湾<rt>わん</rt></ruby>は <ruby>重要<rt>じゅうよう</rt></ruby>な <ruby>役割<rt>やくわり</rt></ruby>を <ruby>果<rt>は</rt></ruby>たしている。,Tokyo Bay plays an important role.,noun
泉<div class="hint">spring; fountain</div>,いずみ,spring; fountain,<ruby>森<rt>もり</rt></ruby>の <ruby>中<rt>なか</rt></ruby>にきれいな <ruby>泉<rt>いずみ</rt></ruby>があるの。,There is a beautiful spring in the forest.,noun
泥<div class="hint">mud</div>,どろ,mud,<ruby>靴<rt>くつ</rt></ruby>が <ruby>泥<rt>どろ</rt></ruby>だらけになったよ。,My shoes were covered in mud.,noun
濡らす<div class="hint">get (something) wet</div>,ぬらす,get (something) wet,<ruby>携帯<rt>けいたい</rt></ruby> <ruby>電話<rt>でんわ</rt></ruby>を <ruby>水<rt>みず</rt></ruby>で <ruby>濡<rt>ぬ</rt></ruby>らしてしまったんだ。,I got my cell phone wet.,verb
スライド<div class="hint">slide</div>,すらいど,slide,このふたはスライドします。,This cover slides aside.,verbal noun
叫ぶ<div class="hint">shout; cry out</div>,さけぶ,shout; cry out,<ruby>彼女<rt>かのじょ</rt></ruby>は <ruby>助<rt>たす</rt></ruby>けを <ruby>求<rt>もと</rt></ruby>めて <ruby>大声<rt>おおごえ</rt></ruby>で <ruby>叫<rt>さけ</rt></ruby>んだの。,She cried out for help.,verb
吐く<div class="hint">holler; vomit</div>,はく,holler; vomit,<ruby>彼<rt>かれ</rt></ruby>は <ruby>乱暴<rt>らんぼう</rt></ruby>な <ruby>言葉<rt>ことば</rt></ruby>を <ruby>吐<rt>は</rt></ruby>いたぞ。,He hollered some harsh words.,verb
虫歯<div class="hint">cavity</div>,むしば,cavity,<ruby>虫歯<rt>むしば</rt></ruby>が <ruby>痛<rt>いた</rt></ruby>い。,My cavity hurts.,noun
恵まれる<div class="hint">be blessed; be fortunate enough</div>,めぐまれる,be blessed; be fortunate enough,<ruby>当日<rt>とうじつ</rt></ruby>は <ruby>天気<rt>てんき</rt></ruby>に <ruby>恵<rt>めぐ</rt></ruby>まれました。,We were fortunate enough to enjoy the good weather that day.,verb
道徳<div class="hint">morality; ethic</div>,どうとく,morality; ethic,<ruby>子供<rt>こども</rt></ruby>には <ruby>道徳<rt>どうとく</rt></ruby>をきちんと <ruby>教<rt>おし</rt></ruby>えていきたいと <ruby>思<rt>おも</rt></ruby>います。,I'd like to properly teach ethics to my children.,noun
サークル<div class="hint">circle; club</div>,さーくる,circle; club,どのサークルに <ruby>入<rt>はい</rt></ruby>るか <ruby>迷<rt>まよ</rt></ruby>っちゃった。,I wasn't sure which circle to join.,noun
直径<div class="hint">diameter</div>,ちょっけい,diameter,この <ruby>円<rt>えん</rt></ruby>は <ruby>直径<rt>ちょっけい</rt></ruby>６センチです。,This circle has a diameter of 6cm.,noun
丼<div class="hint">bowl</div>,どんぶり,bowl,<ruby>彼<rt>かれ</rt></ruby>はご <ruby>飯<rt>はん</rt></ruby>を <ruby>丼<rt>どんぶり</rt></ruby>で <ruby>食<rt>た</rt></ruby>べたよ。,He ate rice in a bowl.,noun
豆<div class="hint">bean; peas</div>,まめ,bean; peas,<ruby>今<rt>いま</rt></ruby>、 <ruby>豆<rt>まめ</rt></ruby>を <ruby>煮<rt>に</rt></ruby>ています。,I'm cooking some beans now.,noun
粉<div class="hint">powder; flour</div>,こな,powder; flour,その <ruby>白<rt>しろ</rt></ruby>い <ruby>粉<rt>こな</rt></ruby>は <ruby>赤<rt>あか</rt></ruby>ちゃんのミルクです。,The white powder is baby's milk.,noun
粒<div class="hint">grain; drop</div>,つぶ,grain; drop,その <ruby>子<rt>こ</rt></ruby>は <ruby>大<rt>おお</rt></ruby> <ruby>粒<rt>つぶ</rt></ruby>の <ruby>涙<rt>なみだ</rt></ruby>を <ruby>浮<rt>う</rt></ruby>かべていたの。,The child's eyes were brimming with big teardrops.,noun
クラシック<div class="hint">classical music; the classics</div>,くらしっく,classical music; the classics,<ruby>彼女<rt>かのじょ</rt></ruby>はクラシック <ruby>音楽<rt>おんがく</rt></ruby>が <ruby>好<rt>す</rt></ruby>きです。,She likes classical music.,adjectival noun
炎<div class="hint">flame; blaze</div>,ほのお,flame; blaze,ろうそくの <ruby>炎<rt>ほのお</rt></ruby>が <ruby>部屋<rt>へや</rt></ruby>を <ruby>照<rt>て</rt></ruby>らしたんだ。,The candle flame lit the room.,noun
西暦<div class="hint">Christian Era; A.D.</div>,せいれき,Christian Era; A.D.,<ruby>西暦<rt>せいれき</rt></ruby>１９６４ <ruby>年<rt>ねん</rt></ruby>に <ruby>東京<rt>とうきょう</rt></ruby>でオリンピックがあった。,The Tokyo Olympics were held in 1964.,noun
皮<div class="hint">peel; skin</div>,かわ,peel; skin,りんごの <ruby>皮<rt>かわ</rt></ruby>をむきましたよ。,I peeled an apple.,noun
皮肉<div class="hint">sarcasm; irony</div>,ひにく,sarcasm; irony,<ruby>彼<rt>かれ</rt></ruby>は <ruby>皮肉<rt>ひにく</rt></ruby>ばかり <ruby>言<rt>い</rt></ruby>います。,He always says sarcastic things.,noun
皮膚<div class="hint">skin</div>,ひふ,skin,<ruby>冬<rt>ふゆ</rt></ruby>は <ruby>皮膚<rt>ひふ</rt></ruby>が <ruby>乾燥<rt>かんそう</rt></ruby>しますね。,Our skin dries out in winter.,noun
もしも<div class="hint">if; if ever</div>,もしも,if; if ever,もしも <ruby>彼女<rt>かのじょ</rt></ruby>と <ruby>結婚<rt>けっこん</rt></ruby>できたらどんなに <ruby>嬉<rt>うれ</rt></ruby>しいだろう。,If I could ever marry her; how happy I would be!,adverb
唇<div class="hint">lip</div>,くちびる,lip,<ruby>寒<rt>さむ</rt></ruby>くて <ruby>唇<rt>くちびる</rt></ruby>が <ruby>青<rt>あお</rt></ruby>くなってしまった。,My lips have turned blue with cold.,noun
面倒臭い<div class="hint">troublesome; tiresome</div>,めんどうくさい,troublesome; tiresome,この <ruby>計算<rt>けいさん</rt></ruby>は <ruby>面倒臭<rt>めんどうくさ</rt></ruby>いなあ。,This calculation is troublesome.,adjective
解釈<div class="hint">interpretation; explanation</div>,かいしゃく,interpretation; explanation,この <ruby>詩<rt>し</rt></ruby>を <ruby>解釈<rt>かいしゃく</rt></ruby>してみましょう。,Let's try to interpret this poem.,verbal noun
掘る<div class="hint">dig; unearth</div>,ほる,dig; unearth,ここに <ruby>穴<rt>あな</rt></ruby>を <ruby>掘<rt>ほ</rt></ruby>りましょう。,Let's dig a hole here.,verb
一層<div class="hint">(even) more</div>,いっそう,(even) more,<ruby>雨<rt>あめ</rt></ruby>が <ruby>一層<rt>いっそう</rt></ruby> <ruby>激<rt>はげ</rt></ruby>しくなったね。,The rain got even heavier.,adverb
プリント<div class="hint">print</div>,ぷりんと,print,デジカメで <ruby>撮<rt>と</rt></ruby>った <ruby>写真<rt>しゃしん</rt></ruby>をプリントしたんだ。,I printed out the photograph that I took with my digital camera.,verbal noun
履歴書<div class="hint">resume; curriculum vitae</div>,りれきしょ,resume; curriculum vitae,<ruby>面接<rt>めんせつ</rt></ruby>のために <ruby>履歴<rt>りれき</rt></ruby> <ruby>書<rt>しょ</rt></ruby>を <ruby>書<rt>か</rt></ruby>きました。,I wrote a resume for my interview.,noun
覆う<div class="hint">cover up</div>,おおう,cover up,<ruby>雲<rt>くも</rt></ruby>が <ruby>空<rt>そら</rt></ruby>を <ruby>覆<rt>おお</rt></ruby>っているね。,The sky is covered by clouds.,verb
戸棚<div class="hint">cupboard</div>,とだな,cupboard,この <ruby>皿<rt>さら</rt></ruby>を <ruby>戸棚<rt>とだな</rt></ruby>にしまってください。,Please put away this plate in the cupboard.,noun
翌年<div class="hint">the following year</div>,よくねん,the following year,<ruby>彼女<rt>かのじょ</rt></ruby>は <ruby>大学<rt>だいがく</rt></ruby> <ruby>卒業<rt>そつぎょう</rt></ruby>の <ruby>翌年<rt>よくねん</rt></ruby>に <ruby>結婚<rt>けっこん</rt></ruby>したの。,She married the year after graduating from university.,noun
つぐ<div class="hint">pour; pour into</div>,つぐ,pour; pour into,お <ruby>酒<rt>さけ</rt></ruby>をおつぎしましょう。,Let me pour you a drink.,verb
新鮮<div class="hint">fresh</div>,しんせん,fresh,この <ruby>店<rt>みせ</rt></ruby>では <ruby>新鮮<rt>しんせん</rt></ruby>な <ruby>野菜<rt>やさい</rt></ruby>が <ruby>買<rt>か</rt></ruby>えますよ。,You can buy fresh vegetables at this store.,adjectival noun
殴る<div class="hint">hit; punch</div>,なぐる,hit; punch,<ruby>彼<rt>かれ</rt></ruby>は <ruby>思<rt>おも</rt></ruby>わず <ruby>友人<rt>ゆうじん</rt></ruby>を <ruby>殴<rt>なぐ</rt></ruby>ったの。,He punched his friend without thinking.,verb
要旨<div class="hint">overview; summary</div>,ようし,overview; summary,<ruby>会議<rt>かいぎ</rt></ruby>の <ruby>要旨<rt>ようし</rt></ruby>は <ruby>次<rt>つぎ</rt></ruby>のとおりです。,The overview of the meeting is as follows.,noun
幕<div class="hint">curtain</div>,まく,curtain,ステージの <ruby>幕<rt>まく</rt></ruby>が <ruby>上<rt>あ</rt></ruby>がったんだ。,The stage curtain rose.,noun
暮らす<div class="hint">live; lead a life</div>,くらす,live; lead a life,<ruby>将来<rt>しょうらい</rt></ruby>は <ruby>海<rt>うみ</rt></ruby>の <ruby>近<rt>ちか</rt></ruby>くで <ruby>暮<rt>く</rt></ruby>らしたいな。,I want to live near the sea in the future.,verb
ボーナス<div class="hint">bonus</div>,ぼーなす,bonus,<ruby>今年<rt>ことし</rt></ruby>はボーナスがたくさん <ruby>出<rt>で</rt></ruby>ました。,We got a lot of bonuses this year.,noun
暮らし<div class="hint">living; livelihood</div>,くらし,living; livelihood,<ruby>彼女<rt>かのじょ</rt></ruby>は <ruby>毎日<rt>まいにち</rt></ruby>の <ruby>暮<rt>く</rt></ruby>らしを <ruby>楽<rt>たの</rt></ruby>しんでいますね。,She's enjoying her daily life.,noun
墓<div class="hint">grave; gravestone</div>,はか,grave; gravestone,<ruby>祖父<rt>そふ</rt></ruby>の <ruby>墓<rt>はか</rt></ruby>は <ruby>近<rt>ちか</rt></ruby>くにあります。,My grandfather's grave is nearby.,noun
芽<div class="hint">bud; sprout</div>,め,bud; sprout,チューリップの <ruby>芽<rt>め</rt></ruby>が <ruby>出<rt>で</rt></ruby>ました。,The tulip buds have sprouted.,noun
推薦<div class="hint">recommendation; nomination</div>,すいせん,recommendation; nomination,<ruby>彼<rt>かれ</rt></ruby>は <ruby>会長<rt>かいちょう</rt></ruby>に <ruby>推薦<rt>すいせん</rt></ruby>されたよ。,He was nominated as chairperson.,verbal noun
荒れる<div class="hint">be wild; get rough</div>,あれる,be wild; get rough,<ruby>台風<rt>たいふう</rt></ruby>で <ruby>山<rt>やま</rt></ruby>も <ruby>海<rt>うみ</rt></ruby>も <ruby>荒<rt>あ</rt></ruby>れています。,The weather in the typhoon is rough both on the mountains and in the ocean.,verb
ポスター<div class="hint">poster</div>,ぽすたー,poster,<ruby>電柱<rt>でんちゅう</rt></ruby>にポスターが <ruby>貼<rt>は</rt></ruby>ってあった。,There was a poster on the telegraph pole.,noun
慌てる<div class="hint">be flurried; hurry</div>,あわてる,be flurried; hurry,そんなに <ruby>慌<rt>あわ</rt></ruby>ててどこに <ruby>行<rt>い</rt></ruby>くの。,Where are you going in such a hurry?,verb
慌ただしい<div class="hint">busy and hurried</div>,あわただしい,busy and hurried,<ruby>今日<rt>きょう</rt></ruby>は <ruby>慌<rt>あわ</rt></ruby>ただしい <ruby>一<rt>いち</rt></ruby> <ruby>日<rt>にち</rt></ruby>でした。,It was a busy day today.,adjective
儀式<div class="hint">ceremony; ritual</div>,ぎしき,ceremony; ritual,<ruby>儀式<rt>ぎしき</rt></ruby>には <ruby>作法<rt>さほう</rt></ruby>があります。,Ceremonies have their rules of etiquette.,noun
犠牲<div class="hint">sacrifice; loss</div>,ぎせい,sacrifice; loss,<ruby>多<rt>おお</rt></ruby>くの <ruby>人<rt>ひと</rt></ruby>が <ruby>災害<rt>さいがい</rt></ruby>の <ruby>犠牲<rt>ぎせい</rt></ruby>になったの。,A lot of people lost their lives in the disaster.,noun
赤ん坊<div class="hint">(human) baby</div>,あかんぼう,(human) baby,その <ruby>頃<rt>ころ</rt></ruby> <ruby>彼<rt>かれ</rt></ruby>はまだ <ruby>赤<rt>あか</rt></ruby>ん <ruby>坊<rt>ぼう</rt></ruby>だったよね。,He was still a baby in those days.,noun
レンズ<div class="hint">lens</div>,れんず,lens,<ruby>眼鏡<rt>めがね</rt></ruby>のレンズを <ruby>替<rt>か</rt></ruby>えました。,I changed the lenses in my glasses.,noun
旗<div class="hint">flag; banner</div>,はた,flag; banner,<ruby>旗<rt>はた</rt></ruby>が <ruby>風<rt>かぜ</rt></ruby>に <ruby>揺<rt>ゆ</rt></ruby>れている。,The flag is waving in the wind.,noun
竹<div class="hint">bamboo</div>,たけ,bamboo,この <ruby>笛<rt>ふえ</rt></ruby>は <ruby>竹<rt>たけ</rt></ruby>でできている。,This flute is made of bamboo.,noun
筆記用具<div class="hint">pens and pencils; writing materials</div>,ひっきようぐ,pens and pencils; writing materials,<ruby>今日<rt>きょう</rt></ruby>は <ruby>筆記用具<rt>ひっきようぐ</rt></ruby>を <ruby>忘<rt>わす</rt></ruby>れました。,I forgot my writing materials today.,noun
筆者<div class="hint">writer; author</div>,ひっしゃ,writer; author,<ruby>筆者<rt>ひっしゃ</rt></ruby>の <ruby>趣旨<rt>しゅし</rt></ruby>を <ruby>考<rt>かんが</rt></ruby>えてください。,Please consider the author's point.,noun
筆<div class="hint">writing brush</div>,ふで,writing brush,<ruby>彼<rt>かれ</rt></ruby>は <ruby>筆<rt>ふで</rt></ruby>で <ruby>手紙<rt>てがみ</rt></ruby>を <ruby>書<rt>か</rt></ruby>いたの。,He wrote a letter with a brush.,noun
マイク<div class="hint">microphone</div>,まいく,microphone,<ruby>彼女<rt>かのじょ</rt></ruby>はマイクを <ruby>持<rt>も</rt></ruby>って <ruby>話<rt>はな</rt></ruby>し <ruby>始<rt>はじ</rt></ruby>めたの。,She took the microphone and began to talk.,noun
筋<div class="hint">muscle; nerve</div>,すじ,muscle; nerve,<ruby>転<rt>ころ</rt></ruby>んで <ruby>筋<rt>すじ</rt></ruby>を <ruby>痛<rt>いた</rt></ruby>めてしまいました。,I fell down and hurt my tendon.,noun
筋肉<div class="hint">muscle</div>,きんにく,muscle,<ruby>彼<rt>かれ</rt></ruby>は <ruby>最近<rt>さいきん</rt></ruby> <ruby>筋肉<rt>きんにく</rt></ruby>を <ruby>鍛<rt>きた</rt></ruby>えているよ。,He has been building up his muscles recently.,noun
布<div class="hint">cloth</div>,ぬの,cloth,この <ruby>布<rt>ぬの</rt></ruby>はカーテンに <ruby>使<rt>つか</rt></ruby>えます。,This cloth can be used for curtains.,noun
包丁<div class="hint">kitchen knife</div>,ほうちょう,kitchen knife,<ruby>包丁<rt>ほうちょう</rt></ruby>で <ruby>指<rt>ゆび</rt></ruby>を <ruby>切<rt>き</rt></ruby>った。,I cut my finger with a kitchen knife.,noun
抱く<div class="hint">embrace (firmly with affection); have a dream; ambition etc.</div>,いだく,embrace (firmly with affection); have a dream; ambition etc.,<ruby>少年<rt>しょうねん</rt></ruby>よ <ruby>大志<rt>たいし</rt></ruby>を <ruby>抱<rt>いだ</rt></ruby>け。,Boys; be ambitious.,verb
まとめ<div class="hint">summary; conclusion</div>,まとめ,summary; conclusion,<ruby>論文<rt>ろんぶん</rt></ruby>のまとめを <ruby>書<rt>か</rt></ruby>いています。,I'm writing a conclusion of my thesis.,noun
中旬<div class="hint">middle ten days of a month</div>,ちゅうじゅん,middle ten days of a month,<ruby>来月<rt>らいげつ</rt></ruby> <ruby>中旬<rt>ちゅうじゅん</rt></ruby>にフランスへ <ruby>行<rt>い</rt></ruby>きます。,I'll go to France in the middle of next month.,noun
下旬<div class="hint">the last ten days (of a month)</div>,げじゅん,the last ten days (of a month),この <ruby>仕事<rt>しごと</rt></ruby>は <ruby>来月<rt>らいげつ</rt></ruby>の <ruby>下旬<rt>げじゅん</rt></ruby>には <ruby>終<rt>お</rt></ruby>わります。,I'll finish this work at the end of next month.,noun
飽きる<div class="hint">get tired of</div>,あきる,get tired of,その <ruby>子<rt>こ</rt></ruby>はおもちゃに <ruby>飽<rt>あ</rt></ruby>きたようだね。,The child seems to have gotten tired of the toy.,verb
餌<div class="hint">bait; feed</div>,えさ,bait; feed,<ruby>毎日<rt>まいにち</rt></ruby> <ruby>金魚<rt>きんぎょ</rt></ruby>に <ruby>餌<rt>えさ</rt></ruby>をやります。,I feed my goldfish everyday.,noun
通帳<div class="hint">bankbook; passbook</div>,つうちょう,bankbook; passbook,<ruby>銀行<rt>ぎんこう</rt></ruby>の <ruby>通帳<rt>つうちょう</rt></ruby>を <ruby>持<rt>も</rt></ruby>ってきてください。,Please bring your bank book.,noun
どうか<div class="hint">please</div>,どうか,please,どうかお <ruby>許<rt>ゆる</rt></ruby>しください。,Please forgive me.,adverb
旧<div class="hint">old; former</div>,きゅう,old; former,<ruby>旧<rt>きゅう</rt></ruby>ソビエトは <ruby>今<rt>いま</rt></ruby>はロシアと <ruby>呼<rt>よ</rt></ruby>ばれている。,The former Soviet Union is now called Russia.,noun
育児<div class="hint">childcare; child-raising</div>,いくじ,childcare; child-raising,<ruby>彼女<rt>かのじょ</rt></ruby>は <ruby>育児<rt>いくじ</rt></ruby>で <ruby>忙<rt>いそが</rt></ruby>しいよ。,She is busy taking care of her children.,noun
嫁<div class="hint">bride; daughter-in-law</div>,よめ,bride; daughter-in-law,<ruby>姉<rt>あね</rt></ruby>が <ruby>嫁<rt>よめ</rt></ruby>にいったの。,My big sister got married.,noun
幼児<div class="hint">young child</div>,ようじ,young child,<ruby>幼児<rt>ようじ</rt></ruby>は <ruby>入場<rt>にゅうじょう</rt></ruby> <ruby>無料<rt>むりょう</rt></ruby>です。,There's no admission fee for small children.,noun
わく<div class="hint">well up</div>,わく,well up,<ruby>友達<rt>ともだち</rt></ruby>に <ruby>励<rt>はげ</rt></ruby>まされて <ruby>勇気<rt>ゆうき</rt></ruby>がわいたよ。,I felt courage well up within me after my friend's encouragement.,verb
幼い<div class="hint">little; childish</div>,おさない,little; childish,<ruby>彼女<rt>かのじょ</rt></ruby>には <ruby>幼<rt>おさな</rt></ruby>い <ruby>息子<rt>むすこ</rt></ruby>がいます。,She has a little son.,adjective
眼科<div class="hint">ophthalmology; eye clinic</div>,がんか,ophthalmology; eye clinic,<ruby>眼科<rt>がんか</rt></ruby>で <ruby>視力<rt>しりょく</rt></ruby> <ruby>検査<rt>けんさ</rt></ruby>をしました。,I took a vision test at the eye clinic.,noun
居眠り<div class="hint">doze; catnap</div>,いねむり,doze; catnap,<ruby>彼<rt>かれ</rt></ruby>はソファーで <ruby>居眠<rt>いねむ</rt></ruby>りをしているよ。,He is dozing on the sofa.,verbal noun
瞬間<div class="hint">moment</div>,しゅんかん,moment,その <ruby>瞬間<rt>しゅんかん</rt></ruby>、 <ruby>猫<rt>ねこ</rt></ruby>が <ruby>跳<rt>と</rt></ruby>び <ruby>出<rt>だ</rt></ruby>しました。,At that moment; a cat ran out.,noun
一瞬<div class="hint">instant; moment</div>,いっしゅん,instant; moment,<ruby>一瞬<rt>いっしゅん</rt></ruby> <ruby>自分<rt>じぶん</rt></ruby>の <ruby>耳<rt>みみ</rt></ruby>を <ruby>疑<rt>うたが</rt></ruby>ったよ。,For a moment I couldn't believe what I heard.,noun
だます<div class="hint">deceive; cheat</div>,だます,deceive; cheat,<ruby>人<rt>ひと</rt></ruby>をだましてはいけません。,Don't deceive people.,verb
睡眠<div class="hint">sleep</div>,すいみん,sleep,１ <ruby>日<rt>にち</rt></ruby>７ <ruby>時間<rt>じかん</rt></ruby>は <ruby>睡眠<rt>すいみん</rt></ruby>を <ruby>取<rt>と</rt></ruby>るようにしています。,I try to get seven hours of sleep every day.,verbal noun
話し掛ける<div class="hint">speak to (someone)</div>,はなしかける,speak to (someone),<ruby>知<rt>し</rt></ruby>らない <ruby>人<rt>ひと</rt></ruby>が <ruby>話<rt>はな</rt></ruby>し <ruby>掛<rt>か</rt></ruby>けてきた。,A stranger came up and spoke to me.,verb
追い掛ける<div class="hint">chase; run after</div>,おいかける,chase; run after,パトカーがバイクを <ruby>追<rt>お</rt></ruby>いかけてるぞ。,A police car is chasing a motorcycle.,verb
通り掛かる<div class="hint">happen to pass by</div>,とおりかかる,happen to pass by,その <ruby>店<rt>みせ</rt></ruby>を <ruby>通<rt>とお</rt></ruby>り <ruby>掛<rt>か</rt></ruby>かったらバーゲンをやっていた。,When I happened to pass the shop they were having a sale.,verb
